"filename","title","description","feature","topic","role","level"
"./metadata.md","","","","","",""
"./help/using/TOC.md","","","","","",""
"help/using/about-guide.md","About this Guide","This page describes the intent of the Best Practices Guide","","","",""
"help/using/introduction.md","Introduction to [!UICONTROL AEM Screens]","This page is an introductory section to AEM Screens","","","",""
"help/using/roles-responsibilities.md","AEM Screens Project Roles  and Responsibilities","The page describes AEM Screens Project Roles  and Responsibilities","","","",""
"help/using/pre-requisites.md","Prerequisites [!UICONTROL AEM Screens]","The guide describes what are the pre-requisites before starting an AEM Screens project.","","","",""
"help/using/getting-started-digital-signage.md","Basics Of Digital Signage for [!UICONTROL AEM Screens]","The guide describes the basics of a digital signage project","","","",""
"help/using/recommended-approach.md","Recommended Approach","The page describes recommended approach in an AEM Screens project","","","",""
"help/using/pre-sales-considerations.md","Considerations as Projects are Scoped","The page describes Considerations as Projects are Scoped","","","",""
"help/using/business-content-strategy.md","Business Content Strategy for [!UICONTROL AEM Screens]","The guide describes the Business Content Strategy","","","",""
"help/using/ux-dependencies.md","UX Dependencies for [!UICONTROL AEM Screens]","The guide describes UX Dependencies for [!UICONTROL AEM Screens]","","","",""
"help/using/analytics.md","Analytics with AEM Screens","The page describes Analytics with AEM Screens","","","",""
"help/using/journey-map.md","Journey Map","The page describes Journey Map for AEM Screens","","","",""
"help/using/prototypes.md","Prototypes","This page describes Prototypes for an AEM Screens Project","","","",""
"help/using/wireframes.md","Wireframes","The page describes Wireframes for an AEM Screens project","","","",""
"help/using/transition-platform.md","Transition to Platform","The page describes Transition to Platform","","","",""
"help/using/dynamic-creative-optimizations.md","Data Triggers","The page describes data triggers","","","",""
"help/using/aem-platform-configurations.md","AEM Platform Configurations","The page describes AEM Platform Configurations","","","",""
"help/using/project-taxonomy-implementation.md","Project Taxonomy","This page describes Project Taxonomy","","","",""
"./help/using/managing-network-traffic.md","Managing Network Traffic","The page describes Standard Network Setups and how to manage network traffic.","","","",""
"./help/using/direct-internet-network.md","Direct Internet Access","Direct Internet Access","","","",""
"./help/using/mobile-network.md","Direct Mobile Network","The page describes Direct Mobile Network Setup","","","",""
"./help/using/mobile-network-router.md","Mobile Network with Mobile Data Router and Active Network Components","The page describes Mobile Network with Mobile Data Router and Active Network Components","","","",""
"./help/using/enclosed-corporate-network.md","Enclosed Corporate Network","Enclosed Corporate Network","","","",""
"help/using/device-configurations.md","Device Specifications","The page describes device specifications","","","",""
"help/using/testing-quality-assurance.md","Testing and Quality Assurance","The page describes Testing and Quality Assurance for AEM Screens Best Practices Guide","","","",""
"help/using/vendor-engagement.md","Vendor Engagement","The page describes Vendor Engagement for AEM Screens Best Practices Guide","","","",""
"help/using/support-monitoring.md","Support Monitoring","The page describes Support Monitoring for AEM Screens Best Practices Guide","","","",""
"help/using/day-two-support-maintenance.md","Day Two Support and Maintenance","The page describes Day Two Support and Maintenance","","","",""
